<?xml version="1.0"?>
<e:eventi xmlns:e="http://www.imperofiere.com" xmlns:xs="http://www.w3.org/2001/XMLSchema-instance" xs:schemaLocation="eventi.xsd">
	
	
	
	<evento>
		<id>RWx2aXMgUHJlc2xleQ==</id>
		<nome>Elvis Presley</nome>
		<descrizione>Elvis e un grande e a me mi piace atanto. Divertit con Elvis e ad ascolta musica bella che fa ballare ed e' yeah.</descrizione>
		<padiglione>A</padiglione>
		<data>2016-10-12</data>
		<inizio>12:12:00</inizio>
		<fine>13:12:00</fine>
	</evento>
	<evento>
		<id>RGFydGggVmFkZXI=</id>
		<nome>Darth Vader</nome>
		<descrizione>Il discorso tanto atteso di Dark Vader. Il discorso tanto atteso di Dark Vader.Il discorso tanto atteso di Dark Vader.Il discorso tanto atteso di Dark Vader.Il discorso tanto atteso di Dark Vader.Il discorso tanto atteso di Dark Vader.</descrizione>
		<padiglione>G</padiglione>
		<data>2016-05-12</data>
		<inizio>12:12:00</inizio>
		<fine>13:13:00</fine>
	</evento>
	<evento>
		<id>UXVhbGNvc2E=</id>
		<nome>Qualcosa</nome>
		<descrizione>Test Test Test Test Test Test Test Test Test Test Test Test Test Test Test Test Test Test Test Test Test Test Test Test Test Test Test Test Test Test Test Test Test Test Test Test Test Test Test Test Test Test Test Test Test Test Test Test Test Test Test Test Test Test Test Test Test Test Test Test Test Test Test Test Test Test Test Test Test Test Test Test Test Test Test Test Test Test Test Test Test Test Test Test Test Test Test </descrizione>
		<padiglione>A</padiglione>
		<data>2016-05-05</data>
		<inizio>10:20:00</inizio>
		<fine>10:45:00</fine>
	</evento>
	<evento>
		<id>T3JkaW5hbWVudG9BWg==</id>
		<nome>OrdinamentoAZ</nome>
		<descrizione>Test OrdinamentoAZ Test OrdinamentoAZTest OrdinamentoAZTest OrdinamentoAZTest OrdinamentoAZTest OrdinamentoAZTest OrdinamentoAZTest OrdinamentoAZTest OrdinamentoAZTest OrdinamentoAZTest OrdinamentoAZTest OrdinamentoAZ</descrizione>
		<padiglione>G</padiglione>
		<data>2017-05-12</data>
		<inizio>12:15:00</inizio>
		<fine>19:15:00</fine>
	</evento>
</e:eventi>
